<?xml version="1.0" encoding="UTF-8"?>
<!--
Copyright (c) 2015, Andreas P. Koenzen <akc at apkc.net>
All rights reserved.

Redistribution and use in source and binary forms, with or without
modification, are permitted provided that the following conditions are met:

* Redistributions of source code must retain the above copyright notice, this
  list of conditions and the following disclaimer.
* Redistributions in binary form must reproduce the above copyright notice,
  this list of conditions and the following disclaimer in the documentation
  and/or other materials provided with the distribution.

THIS SOFTWARE IS PROVIDED BY THE COPYRIGHT HOLDERS AND CONTRIBUTORS "AS IS"
AND ANY EXPRESS OR IMPLIED WARRANTIES, INCLUDING, BUT NOT LIMITED TO, THE
IMPLIED WARRANTIES OF MERCHANTABILITY AND FITNESS FOR A PARTICULAR PURPOSE
ARE DISCLAIMED. IN NO EVENT SHALL THE COPYRIGHT HOLDER OR CONTRIBUTORS BE
LIABLE FOR ANY DIRECT, INDIRECT, INCIDENTAL, SPECIAL, EXEMPLARY, OR
CONSEQUENTIAL DAMAGES (INCLUDING, BUT NOT LIMITED TO, PROCUREMENT OF
SUBSTITUTE GOODS OR SERVICES; LOSS OF USE, DATA, OR PROFITS; OR BUSINESS
INTERRUPTION) HOWEVER CAUSED AND ON ANY THEORY OF LIABILITY, WHETHER IN
CONTRACT, STRICT LIABILITY, OR TORT (INCLUDING NEGLIGENCE OR OTHERWISE)
ARISING IN ANY WAY OUT OF THE USE OF THIS SOFTWARE, EVEN IF ADVISED OF THE
POSSIBILITY OF SUCH DAMAGE.
-->
<fields 
    definitionID="000"
    scoreCoeficient="1.0"
    xmlns:xsi="http://www.w3.org/2001/XMLSchema-instance" 
    xsi:noNamespaceSchemaLocation="Schema.xsd">
    <!-- FULL EXAMPLE
        <field>
            <lucenevars>
                <analyzer>0|1</analyzer>
                <boost>0.0</boost>
                <docvaluetype>BINARY|NUMERIC|SORTED|SORTED_SET</docvaluetype>
                <indexed>0|1</indexed>
                <indexoptions>DOCS_AND_FREQS|DOCS_AND_FREQS_AND_POSITIONS|DOCS_AND_FREQS_AND_POSITIONS_AND_OFFSETS|DOCS_ONLY</indexoptions>
                <numericprecisionstep>4</numericprecisionstep>
                <numerictype>DOUBLE|FLOAT|INT|LONG</numerictype> 
                <omitnorms>0|1</omitnorms>
                <stored>0|1</stored>
                <storetermvectoroffset>0|1</storetermvectoroffset>
                <storetermvectorpayloads>0|1</storetermvectorpayloads>
                <storetermvectorpositions>0|1</storetermvectorpositions>
                <storetermvectors>0|1</storetermvectors>
                <tokenized>0|1</tokenized>
                <value>NAME_OF_FIELD</value>
            </lucenevars>
            <generalproperties>
                <contentencoding>NONE|BASE64</contentencoding> # Encoding of text inside the XML for indexing.
                <searchable>0|1</searchable>                   # If this field is searchable.
            </generalproperties>
        </field>
    -->
    <field>
        <lucenevars>
            <analyzer>1</analyzer>
            <boost>10.8</boost>
            <indexed>1</indexed>
            <stored>0</stored>
            <tokenized>1</tokenized>
            <value>anchor</value>
        </lucenevars>
        <generalproperties>
            <contentencoding>NONE</contentencoding>
            <searchable>1</searchable>
        </generalproperties>
    </field>
    <field>
        <lucenevars>
            <analyzer>1</analyzer>
            <boost>6.0</boost>
            <indexed>1</indexed>
            <stored>1</stored>
            <tokenized>0</tokenized>
            <value>boost</value>
        </lucenevars>
        <generalproperties>
            <contentencoding>NONE</contentencoding>
            <searchable>0</searchable>
        </generalproperties>
    </field>
    <field>
        <lucenevars>
            <analyzer>1</analyzer>
            <boost>6.0</boost>
            <indexed>1</indexed>
            <stored>1</stored>
            <tokenized>0</tokenized>
            <value>boostwithgravity</value>
        </lucenevars>
        <generalproperties>
            <contentencoding>NONE</contentencoding>
            <searchable>0</searchable>
        </generalproperties>
    </field>
    <field>
        <lucenevars>
            <analyzer>1</analyzer>
            <boost>10.8</boost>
            <indexed>1</indexed>
            <stored>0</stored>
            <tokenized>1</tokenized>
            <value>content</value>
        </lucenevars>
        <generalproperties>
            <contentencoding>BASE64</contentencoding>
            <searchable>1</searchable>
        </generalproperties>
    </field>
    <field>
        <lucenevars>
            <analyzer>1</analyzer>
            <boost>12.0</boost>
            <indexed>1</indexed>
            <stored>0</stored>
            <tokenized>1</tokenized>
            <value>contentraw</value>
        </lucenevars>
        <generalproperties>
            <contentencoding>BASE64</contentencoding>
            <searchable>1</searchable>
        </generalproperties>
    </field>
    <field>
        <lucenevars>
            <analyzer>1</analyzer>
            <boost>11.4</boost>
            <indexed>1</indexed>
            <stored>0</stored>
            <tokenized>1</tokenized>
            <value>contentfilter</value>
        </lucenevars>
        <generalproperties>
            <contentencoding>BASE64</contentencoding>
            <searchable>1</searchable>
        </generalproperties>
    </field>
    <field>
        <lucenevars>
            <analyzer>1</analyzer>
            <boost>6.0</boost>
            <indexed>0</indexed>
            <stored>1</stored>
            <tokenized>0</tokenized>
            <value>contentlength</value>
        </lucenevars>
        <generalproperties>
            <contentencoding>NONE</contentencoding>
            <searchable>0</searchable>
        </generalproperties>
    </field>
    <field>
        <lucenevars>
            <analyzer>1</analyzer>
            <boost>6.0</boost>
            <indexed>1</indexed>
            <stored>1</stored>
            <tokenized>0</tokenized>
            <value>digest</value>
        </lucenevars>
        <generalproperties>
            <contentencoding>NONE</contentencoding>
            <searchable>0</searchable>
        </generalproperties>
    </field>
    <field>
        <lucenevars>
            <analyzer>1</analyzer>
            <boost>9.6</boost>
            <indexed>1</indexed>
            <stored>0</stored>
            <tokenized>0</tokenized>
            <value>domain</value>
        </lucenevars>
        <generalproperties>
            <contentencoding>NONE</contentencoding>
            <searchable>1</searchable>
        </generalproperties>
    </field>
    <field>
        <lucenevars>
            <analyzer>1</analyzer>
            <boost>6.0</boost>
            <indexed>0</indexed>
            <stored>1</stored>
            <tokenized>0</tokenized>
            <value>fetchtime</value>
        </lucenevars>
        <generalproperties>
            <contentencoding>NONE</contentencoding>
            <searchable>0</searchable>
        </generalproperties>
    </field>
    <field>
        <lucenevars>
            <analyzer>1</analyzer>
            <boost>6.0</boost>
            <indexed>1</indexed>
            <stored>1</stored>
            <tokenized>0</tokenized>
            <value>filetype</value>
        </lucenevars>
        <generalproperties>
            <contentencoding>NONE</contentencoding>
            <searchable>1</searchable>
        </generalproperties>
    </field>
    <field>
        <lucenevars>
            <analyzer>1</analyzer>
            <boost>6.0</boost>
            <indexed>0</indexed>
            <stored>1</stored>
            <tokenized>0</tokenized>
            <value>gravity</value>
        </lucenevars>
        <generalproperties>
            <contentencoding>NONE</contentencoding>
            <searchable>0</searchable>
        </generalproperties>
    </field>
    <field>
        <lucenevars>
            <analyzer>1</analyzer>
            <boost>8.4</boost>
            <indexed>1</indexed>
            <stored>0</stored>
            <tokenized>1</tokenized>
            <value>host</value>
        </lucenevars>
        <generalproperties>
            <contentencoding>NONE</contentencoding>
            <searchable>1</searchable>
        </generalproperties>
    </field>
    <field>
        <lucenevars>
            <analyzer>1</analyzer>
            <boost>6.0</boost>
            <indexed>1</indexed>
            <stored>1</stored>
            <tokenized>0</tokenized>
            <value>indextime</value>
        </lucenevars>
        <generalproperties>
            <contentencoding>NONE</contentencoding>
            <searchable>0</searchable>
        </generalproperties>
    </field>
    <field>
        <lucenevars>
            <analyzer>1</analyzer>
            <boost>6.0</boost>
            <indexed>1</indexed>
            <stored>1</stored>
            <tokenized>0</tokenized>
            <value>itsecond</value>
        </lucenevars>
        <generalproperties>
            <contentencoding>NONE</contentencoding>
            <searchable>0</searchable>
        </generalproperties>
    </field>
    <field>
        <lucenevars>
            <analyzer>1</analyzer>
            <boost>6.0</boost>
            <indexed>1</indexed>
            <stored>1</stored>
            <tokenized>0</tokenized>
            <value>itminute</value>
        </lucenevars>
        <generalproperties>
            <contentencoding>NONE</contentencoding>
            <searchable>0</searchable>
        </generalproperties>
    </field>
    <field>
        <lucenevars>
            <analyzer>1</analyzer>
            <boost>6.0</boost>
            <indexed>1</indexed>
            <stored>1</stored>
            <tokenized>0</tokenized>
            <value>ithour</value>
        </lucenevars>
        <generalproperties>
            <contentencoding>NONE</contentencoding>
            <searchable>0</searchable>
        </generalproperties>
    </field>
    <field>
        <lucenevars>